2026-01-16 00:02:31,350 - INFO - 
================================================================================
2026-01-16 00:02:31,350 - INFO - AADHAAR DATA CLEANING PIPELINE - STARTED
2026-01-16 00:02:31,351 - INFO - ================================================================================

2026-01-16 00:02:31,351 - INFO - 
================================================================================
2026-01-16 00:02:31,351 - INFO - PROCESSING: AADHAAR BIOMETRIC UPDATE DATASET
2026-01-16 00:02:31,351 - INFO - ================================================================================
2026-01-16 00:02:31,353 - INFO -   Loading api_data_aadhar_biometric_0_500000.csv...
2026-01-16 00:02:31,930 - INFO -   Loading api_data_aadhar_biometric_1000000_1500000.csv...
2026-01-16 00:02:32,520 - INFO -   Loading api_data_aadhar_biometric_1500000_1861108.csv...
2026-01-16 00:02:32,942 - INFO -   Loading api_data_aadhar_biometric_500000_1000000.csv...
2026-01-16 00:02:33,523 - INFO - Combined shape: (1861108, 6)
2026-01-16 00:02:33,524 - INFO - Step 1: Fixing schema and datatypes for AADHAAR BIOMETRIC UPDATE DATASET
2026-01-16 00:02:33,915 - INFO -   [OK] Schema fixed. Shape: (1861108, 6)
2026-01-16 00:02:33,915 - INFO - Step 2: Standardizing state names
2026-01-16 00:02:39,019 - WARNING -   [WARNING] 20471 invalid state entries found
2026-01-16 00:02:39,029 - WARNING -      'jammu and kashmir': 19960 records
2026-01-16 00:02:39,029 - WARNING -      'dadra and nagar haveli': 425 records
2026-01-16 00:02:39,029 - WARNING -      'west bangal': 51 records
2026-01-16 00:02:39,030 - WARNING -      'westbengal': 29 records
2026-01-16 00:02:39,030 - WARNING -      'chhatisgarh': 5 records
2026-01-16 00:02:39,030 - WARNING -      'tamilnadu': 1 records
2026-01-16 00:02:39,419 - INFO -   [OK] States standardized. Valid states: 36/36
2026-01-16 00:02:39,420 - INFO - Step 3: Standardizing district names
2026-01-16 00:02:44,322 - INFO -   [OK] Districts standardized. Unique districts: 949
2026-01-16 00:02:44,322 - INFO - Step 4: Validating PIN codes
2026-01-16 00:02:47,406 - INFO -   [OK] PIN codes validated. Records retained: 1861108/1861108
2026-01-16 00:02:47,473 - INFO - Step 5: Handling numeric outliers
2026-01-16 00:02:47,522 - INFO -   Column 'updates_age_5_17':
2026-01-16 00:02:47,523 - INFO -     95th percentile: 61
2026-01-16 00:02:47,523 - INFO -     99th percentile: 298
2026-01-16 00:02:47,523 - INFO -     Max value: 8002
2026-01-16 00:02:47,523 - INFO -     Outliers (>99th): 18546
2026-01-16 00:02:47,555 - INFO -     [OK] Capped at 99th percentile
2026-01-16 00:02:47,608 - INFO -   Column 'updates_age_18_plus':
2026-01-16 00:02:47,608 - INFO -     95th percentile: 62
2026-01-16 00:02:47,609 - INFO -     99th percentile: 324
2026-01-16 00:02:47,609 - INFO -     Max value: 7625
2026-01-16 00:02:47,609 - INFO -     Outliers (>99th): 18574
2026-01-16 00:02:47,635 - INFO -     [OK] Capped at 99th percentile
2026-01-16 00:02:47,636 - INFO - Step 6: Aggregating data to monthly level
2026-01-16 00:02:48,740 - INFO -   [OK] Aggregated from 1861108 daily records to 222707 monthly records
2026-01-16 00:02:48,811 - INFO - Step 7: Calculating data quality metrics
2026-01-16 00:02:48,929 - INFO -   [OK] Quality metrics added
2026-01-16 00:02:48,929 - INFO - Final cleaned shape: (222707, 9)

2026-01-16 00:02:49,031 - INFO - 
================================================================================
2026-01-16 00:02:49,032 - INFO - PROCESSING: AADHAAR DEMOGRAPHIC UPDATE DATASET
2026-01-16 00:02:49,032 - INFO - ================================================================================
2026-01-16 00:02:49,033 - INFO -   Loading api_data_aadhar_demographic_0_500000.csv...
2026-01-16 00:02:49,597 - INFO -   Loading api_data_aadhar_demographic_1000000_1500000.csv...
2026-01-16 00:02:50,149 - INFO -   Loading api_data_aadhar_demographic_1500000_2000000.csv...
2026-01-16 00:02:50,713 - INFO -   Loading api_data_aadhar_demographic_2000000_2071700.csv...
2026-01-16 00:02:50,803 - INFO -   Loading api_data_aadhar_demographic_500000_1000000.csv...
2026-01-16 00:02:51,414 - INFO - Combined shape: (2071700, 6)
2026-01-16 00:02:51,414 - INFO - Step 1: Fixing schema and datatypes for AADHAAR DEMOGRAPHIC UPDATE DATASET
2026-01-16 00:02:51,915 - INFO -   [OK] Schema fixed. Shape: (2071700, 6)
2026-01-16 00:02:51,915 - INFO - Step 2: Standardizing state names
2026-01-16 00:02:57,666 - WARNING -   [WARNING] 21305 invalid state entries found
2026-01-16 00:02:57,679 - WARNING -      'jammu and kashmir': 20601 records
2026-01-16 00:02:57,679 - WARNING -      'dadra and nagar haveli': 425 records
2026-01-16 00:02:57,679 - WARNING -      'westbengal': 132 records
2026-01-16 00:02:57,680 - WARNING -      'west bangal': 127 records
2026-01-16 00:02:57,680 - WARNING -      'chhatisgarh': 4 records
2026-01-16 00:02:57,680 - WARNING -      'west bengli': 3 records
2026-01-16 00:02:57,680 - WARNING -      'darbhanga': 2 records
2026-01-16 00:02:57,680 - WARNING -      'balanagar': 2 records
2026-01-16 00:02:57,680 - WARNING -      'jaipur': 2 records
2026-01-16 00:02:57,681 - WARNING -      'madanapalle': 2 records
2026-01-16 00:02:57,681 - WARNING -      '100000': 2 records
2026-01-16 00:02:57,681 - WARNING -      'puttenahalli': 1 records
2026-01-16 00:02:57,681 - WARNING -      'nagpur': 1 records
2026-01-16 00:02:57,682 - WARNING -      'raja annamalai puram': 1 records
2026-01-16 00:02:58,193 - INFO -   [OK] States standardized. Valid states: 36/36
2026-01-16 00:02:58,193 - INFO - Step 3: Standardizing district names
2026-01-16 00:03:03,805 - INFO -   [OK] Districts standardized. Unique districts: 960
2026-01-16 00:03:03,805 - INFO - Step 4: Validating PIN codes
2026-01-16 00:03:07,264 - INFO -   [OK] PIN codes validated. Records retained: 2071700/2071700
2026-01-16 00:03:07,339 - INFO - Step 5: Handling numeric outliers
2026-01-16 00:03:07,400 - INFO -   Column 'updates_age_5_17':
2026-01-16 00:03:07,400 - INFO -     95th percentile: 7
2026-01-16 00:03:07,401 - INFO -     99th percentile: 22
2026-01-16 00:03:07,401 - INFO -     Max value: 2690
2026-01-16 00:03:07,401 - INFO -     Outliers (>99th): 20037
2026-01-16 00:03:07,429 - INFO -     [OK] Capped at 99th percentile
2026-01-16 00:03:07,485 - INFO -   Column 'updates_age_18_plus':
2026-01-16 00:03:07,485 - INFO -     95th percentile: 60
2026-01-16 00:03:07,486 - INFO -     99th percentile: 226
2026-01-16 00:03:07,486 - INFO -     Max value: 16166
2026-01-16 00:03:07,486 - INFO -     Outliers (>99th): 20663
2026-01-16 00:03:07,514 - INFO -     [OK] Capped at 99th percentile
2026-01-16 00:03:07,515 - INFO - Step 6: Aggregating data to monthly level
2026-01-16 00:03:08,717 - INFO -   [OK] Aggregated from 2071700 daily records to 131091 monthly records
2026-01-16 00:03:08,795 - INFO - Step 7: Calculating data quality metrics
2026-01-16 00:03:08,857 - INFO -   [OK] Quality metrics added
2026-01-16 00:03:08,857 - INFO - Final cleaned shape: (131091, 9)

2026-01-16 00:03:08,918 - INFO - 
================================================================================
2026-01-16 00:03:08,918 - INFO - PROCESSING: AADHAAR ENROLMENT DATASET
2026-01-16 00:03:08,919 - INFO - ================================================================================
2026-01-16 00:03:08,927 - INFO -   Loading api_data_aadhar_enrolment_0_500000.csv...
2026-01-16 00:03:09,475 - INFO -   Loading api_data_aadhar_enrolment_1000000_1006029.csv...
2026-01-16 00:03:09,489 - INFO -   Loading api_data_aadhar_enrolment_500000_1000000.csv...
2026-01-16 00:03:10,084 - INFO - Combined shape: (1006029, 7)
2026-01-16 00:03:10,084 - INFO - Step 1: Fixing schema and datatypes for AADHAAR ENROLMENT DATASET
2026-01-16 00:03:10,309 - INFO -   [OK] Schema fixed. Shape: (1006029, 7)
2026-01-16 00:03:10,310 - INFO - Step 2: Standardizing state names
2026-01-16 00:03:13,053 - WARNING -   [WARNING] 11681 invalid state entries found
2026-01-16 00:03:13,060 - WARNING -      'jammu and kashmir': 11455 records
2026-01-16 00:03:13,060 - WARNING -      'dadra and nagar haveli': 186 records
2026-01-16 00:03:13,060 - WARNING -      '100000': 22 records
2026-01-16 00:03:13,060 - WARNING -      'west bangal': 9 records
2026-01-16 00:03:13,060 - WARNING -      'westbengal': 7 records
2026-01-16 00:03:13,060 - WARNING -      'the dadra and nagar haveli and daman and diu': 2 records
2026-01-16 00:03:13,302 - INFO -   [OK] States standardized. Valid states: 36/36
2026-01-16 00:03:13,302 - INFO - Step 3: Standardizing district names
2026-01-16 00:03:16,028 - INFO -   [OK] Districts standardized. Unique districts: 964
2026-01-16 00:03:16,028 - INFO - Step 4: Validating PIN codes
2026-01-16 00:03:17,674 - INFO -   [OK] PIN codes validated. Records retained: 1006029/1006029
2026-01-16 00:03:17,713 - INFO - Step 5: Handling numeric outliers
2026-01-16 00:03:17,748 - INFO -   Column 'enrollments_age_0_5':
2026-01-16 00:03:17,748 - INFO -     95th percentile: 10
2026-01-16 00:03:17,748 - INFO -     99th percentile: 23
2026-01-16 00:03:17,749 - INFO -     Max value: 2688
2026-01-16 00:03:17,749 - INFO -     Outliers (>99th): 10053
2026-01-16 00:03:17,762 - INFO -     [OK] Capped at 99th percentile
2026-01-16 00:03:17,799 - INFO -   Column 'enrollments_age_5_17':
2026-01-16 00:03:17,799 - INFO -     95th percentile: 6
2026-01-16 00:03:17,799 - INFO -     99th percentile: 14
2026-01-16 00:03:17,799 - INFO -     Max value: 1812
2026-01-16 00:03:17,799 - INFO -     Outliers (>99th): 9596
2026-01-16 00:03:17,814 - INFO -     [OK] Capped at 99th percentile
2026-01-16 00:03:17,838 - INFO -   Column 'enrollments_age_18_plus':
2026-01-16 00:03:17,838 - INFO -     95th percentile: 0
2026-01-16 00:03:17,838 - INFO -     99th percentile: 2
2026-01-16 00:03:17,838 - INFO -     Max value: 855
2026-01-16 00:03:17,838 - INFO -     Outliers (>99th): 8641
2026-01-16 00:03:17,853 - INFO -     [OK] Capped at 99th percentile
2026-01-16 00:03:17,853 - INFO - Step 6: Aggregating data to monthly level
2026-01-16 00:03:18,474 - INFO -   [OK] Aggregated from 1006029 daily records to 106498 monthly records
2026-01-16 00:03:18,515 - INFO - Step 7: Calculating data quality metrics
2026-01-16 00:03:18,568 - INFO -   [OK] Quality metrics added
2026-01-16 00:03:18,568 - INFO - Final cleaned shape: (106498, 10)

2026-01-16 00:03:18,598 - INFO - 
================================================================================
2026-01-16 00:03:18,598 - INFO - STEP 9: Merging datasets into master table
2026-01-16 00:03:18,598 - INFO - ================================================================================
2026-01-16 00:03:18,887 - INFO - After biometric + demographic merge: (227664, 14)
2026-01-16 00:03:19,889 - INFO - After enrolment merge: (228656, 20)
2026-01-16 00:03:19,932 - INFO - [OK] Master dataset created with 10 activity columns

2026-01-16 00:03:28,846 - INFO - Creating visualization report...
2026-01-16 00:03:34,225 - INFO - 
================================================================================
2026-01-16 00:03:34,225 - INFO - GENERATING CLEANING SUMMARY REPORT
2026-01-16 00:03:34,226 - INFO - ================================================================================

2026-01-16 00:03:34,388 - INFO - CLEANING SUMMARY:
2026-01-16 00:03:34,388 - INFO -   Biometric:  222,707 records, 42 states, 56,708,321 total activity
2026-01-16 00:03:34,389 - INFO -   Demographic: 131,091 records, 50 states, 35,784,377 total activity
2026-01-16 00:03:34,389 - INFO -   Enrolment:   106,498 records, 42 states, 4,120,760 total activity
2026-01-16 00:03:34,389 - INFO -   Master:      228,656 records, 52 states

2026-01-16 00:03:34,391 - INFO - 
================================================================================
2026-01-16 00:03:34,392 - INFO - PIPELINE COMPLETED SUCCESSFULLY [OK]
2026-01-16 00:03:34,392 - INFO - ================================================================================
2026-01-16 00:15:16,040 - INFO - 
================================================================================
2026-01-16 00:15:16,041 - INFO - AADHAAR DATA CLEANING PIPELINE - STARTED
2026-01-16 00:15:16,041 - INFO - ================================================================================

2026-01-16 00:15:16,041 - INFO - 
================================================================================
2026-01-16 00:15:16,042 - INFO - PROCESSING: AADHAAR BIOMETRIC UPDATE DATASET
2026-01-16 00:15:16,042 - INFO - ================================================================================
2026-01-16 00:15:16,043 - INFO -   Loading api_data_aadhar_biometric_0_500000.csv...
2026-01-16 00:15:16,537 - INFO -   Loading api_data_aadhar_biometric_1000000_1500000.csv...
2026-01-16 00:15:17,022 - INFO -   Loading api_data_aadhar_biometric_1500000_1861108.csv...
2026-01-16 00:15:17,379 - INFO -   Loading api_data_aadhar_biometric_500000_1000000.csv...
2026-01-16 00:15:17,919 - INFO - Combined shape: (1861108, 6)
2026-01-16 00:15:17,920 - INFO - Step 1: Fixing schema and datatypes for AADHAAR BIOMETRIC UPDATE DATASET
2026-01-16 00:15:18,310 - INFO -   [OK] Schema fixed. Shape: (1861108, 6)
2026-01-16 00:15:18,311 - INFO - Step 2: Standardizing state names
2026-01-16 00:15:24,761 - INFO -   Valid states: 1861022
2026-01-16 00:15:24,762 - INFO -   Invalid states: 86
2026-01-16 00:15:24,768 - WARNING -   [WARNING] Top invalid state entries:
2026-01-16 00:15:24,768 - WARNING -      'west bangal': 51 records
2026-01-16 00:15:24,768 - WARNING -      'westbengal': 29 records
2026-01-16 00:15:24,769 - WARNING -      'chhatisgarh': 5 records
2026-01-16 00:15:24,769 - WARNING -      'tamilnadu': 1 records
2026-01-16 00:15:25,514 - INFO -   [OK] States standardized. Valid unique states: 36/36
2026-01-16 00:15:25,554 - INFO - Step 3: Standardizing district names
2026-01-16 00:15:29,927 - INFO -   [OK] Districts standardized. Unique districts: 949
2026-01-16 00:15:29,928 - INFO - Step 4: Validating PIN codes
2026-01-16 00:15:32,892 - INFO -   [OK] PIN codes validated. Records retained: 1861022/1861022
2026-01-16 00:15:32,938 - INFO - Step 5: Handling numeric outliers
2026-01-16 00:15:33,020 - INFO -   Column 'updates_age_5_17':
2026-01-16 00:15:33,021 - INFO -     95th percentile: 61
2026-01-16 00:15:33,021 - INFO -     99th percentile: 298
2026-01-16 00:15:33,022 - INFO -     Max value: 8002
2026-01-16 00:15:33,022 - INFO -     Outliers (>99th): 18546
2026-01-16 00:15:33,050 - INFO -     [OK] Capped at 99th percentile
2026-01-16 00:15:33,122 - INFO -   Column 'updates_age_18_plus':
2026-01-16 00:15:33,123 - INFO -     95th percentile: 62
2026-01-16 00:15:33,123 - INFO -     99th percentile: 324
2026-01-16 00:15:33,123 - INFO -     Max value: 7625
2026-01-16 00:15:33,124 - INFO -     Outliers (>99th): 18574
2026-01-16 00:15:33,150 - INFO -     [OK] Capped at 99th percentile
2026-01-16 00:15:33,151 - INFO - Step 6: Aggregating data to monthly level
2026-01-16 00:15:34,226 - INFO -   [OK] Aggregated from 1861022 daily records to 222617 monthly records
2026-01-16 00:15:34,305 - INFO - Step 7: Calculating data quality metrics
2026-01-16 00:15:34,406 - INFO -   [OK] Quality metrics added
2026-01-16 00:15:34,406 - INFO - Final cleaned shape: (222617, 9)

2026-01-16 00:15:34,470 - INFO - 
================================================================================
2026-01-16 00:15:34,470 - INFO - PROCESSING: AADHAAR DEMOGRAPHIC UPDATE DATASET
2026-01-16 00:15:34,471 - INFO - ================================================================================
2026-01-16 00:15:34,472 - INFO -   Loading api_data_aadhar_demographic_0_500000.csv...
2026-01-16 00:15:34,966 - INFO -   Loading api_data_aadhar_demographic_1000000_1500000.csv...
2026-01-16 00:15:35,465 - INFO -   Loading api_data_aadhar_demographic_1500000_2000000.csv...
2026-01-16 00:15:35,946 - INFO -   Loading api_data_aadhar_demographic_2000000_2071700.csv...
2026-01-16 00:15:36,027 - INFO -   Loading api_data_aadhar_demographic_500000_1000000.csv...
2026-01-16 00:15:36,580 - INFO - Combined shape: (2071700, 6)
2026-01-16 00:15:36,581 - INFO - Step 1: Fixing schema and datatypes for AADHAAR DEMOGRAPHIC UPDATE DATASET
2026-01-16 00:15:37,087 - INFO -   [OK] Schema fixed. Shape: (2071700, 6)
2026-01-16 00:15:37,087 - INFO - Step 2: Standardizing state names
2026-01-16 00:15:43,865 - INFO -   Valid states: 2071421
2026-01-16 00:15:43,866 - INFO -   Invalid states: 279
2026-01-16 00:15:43,870 - WARNING -   [WARNING] Top invalid state entries:
2026-01-16 00:15:43,870 - WARNING -      'westbengal': 132 records
2026-01-16 00:15:43,870 - WARNING -      'west bangal': 127 records
2026-01-16 00:15:43,871 - WARNING -      'chhatisgarh': 4 records
2026-01-16 00:15:43,871 - WARNING -      'west bengli': 3 records
2026-01-16 00:15:43,871 - WARNING -      'darbhanga': 2 records
2026-01-16 00:15:43,872 - WARNING -      'balanagar': 2 records
2026-01-16 00:15:43,872 - WARNING -      'jaipur': 2 records
2026-01-16 00:15:43,872 - WARNING -      'madanapalle': 2 records
2026-01-16 00:15:43,873 - WARNING -      '100000': 2 records
2026-01-16 00:15:43,873 - WARNING -      'puttenahalli': 1 records
2026-01-16 00:15:44,642 - INFO -   [OK] States standardized. Valid unique states: 36/36
2026-01-16 00:15:44,684 - INFO - Step 3: Standardizing district names
2026-01-16 00:15:49,681 - INFO -   [OK] Districts standardized. Unique districts: 952
2026-01-16 00:15:49,682 - INFO - Step 4: Validating PIN codes
2026-01-16 00:15:53,193 - INFO -   [OK] PIN codes validated. Records retained: 2071421/2071421
2026-01-16 00:15:53,243 - INFO - Step 5: Handling numeric outliers
2026-01-16 00:15:53,297 - INFO -   Column 'updates_age_5_17':
2026-01-16 00:15:53,298 - INFO -     95th percentile: 7
2026-01-16 00:15:53,298 - INFO -     99th percentile: 22
2026-01-16 00:15:53,298 - INFO -     Max value: 2690
2026-01-16 00:15:53,299 - INFO -     Outliers (>99th): 20037
2026-01-16 00:15:53,330 - INFO -     [OK] Capped at 99th percentile
2026-01-16 00:15:53,389 - INFO -   Column 'updates_age_18_plus':
2026-01-16 00:15:53,390 - INFO -     95th percentile: 60
2026-01-16 00:15:53,390 - INFO -     99th percentile: 226
2026-01-16 00:15:53,391 - INFO -     Max value: 16166
2026-01-16 00:15:53,391 - INFO -     Outliers (>99th): 20663
2026-01-16 00:15:53,426 - INFO -     [OK] Capped at 99th percentile
2026-01-16 00:15:53,427 - INFO - Step 6: Aggregating data to monthly level
2026-01-16 00:15:55,096 - INFO -   [OK] Aggregated from 2071421 daily records to 130988 monthly records
2026-01-16 00:15:55,181 - INFO - Step 7: Calculating data quality metrics
2026-01-16 00:15:55,261 - INFO -   [OK] Quality metrics added
2026-01-16 00:15:55,262 - INFO - Final cleaned shape: (130988, 9)

2026-01-16 00:15:55,341 - INFO - 
================================================================================
2026-01-16 00:15:55,342 - INFO - PROCESSING: AADHAAR ENROLMENT DATASET
2026-01-16 00:15:55,342 - INFO - ================================================================================
2026-01-16 00:15:55,343 - INFO -   Loading api_data_aadhar_enrolment_0_500000.csv...
2026-01-16 00:15:55,961 - INFO -   Loading api_data_aadhar_enrolment_1000000_1006029.csv...
2026-01-16 00:15:55,980 - INFO -   Loading api_data_aadhar_enrolment_500000_1000000.csv...
2026-01-16 00:15:56,696 - INFO - Combined shape: (1006029, 7)
2026-01-16 00:15:56,696 - INFO - Step 1: Fixing schema and datatypes for AADHAAR ENROLMENT DATASET
2026-01-16 00:15:56,955 - INFO -   [OK] Schema fixed. Shape: (1006029, 7)
2026-01-16 00:15:56,955 - INFO - Step 2: Standardizing state names
2026-01-16 00:16:00,906 - INFO -   Valid states: 1005989
2026-01-16 00:16:00,907 - INFO -   Invalid states: 40
2026-01-16 00:16:00,910 - WARNING -   [WARNING] Top invalid state entries:
2026-01-16 00:16:00,911 - WARNING -      '100000': 22 records
2026-01-16 00:16:00,911 - WARNING -      'west bangal': 9 records
2026-01-16 00:16:00,911 - WARNING -      'westbengal': 7 records
2026-01-16 00:16:00,912 - WARNING -      'the dadra and nagar haveli and daman and diu': 2 records
2026-01-16 00:16:01,348 - INFO -   [OK] States standardized. Valid unique states: 36/36
2026-01-16 00:16:01,368 - INFO - Step 3: Standardizing district names
2026-01-16 00:16:04,488 - INFO -   [OK] Districts standardized. Unique districts: 963
2026-01-16 00:16:04,489 - INFO - Step 4: Validating PIN codes
2026-01-16 00:16:06,505 - INFO -   [OK] PIN codes validated. Records retained: 1005989/1005989
2026-01-16 00:16:06,526 - INFO - Step 5: Handling numeric outliers
2026-01-16 00:16:06,567 - INFO -   Column 'enrollments_age_0_5':
2026-01-16 00:16:06,568 - INFO -     95th percentile: 10
2026-01-16 00:16:06,568 - INFO -     99th percentile: 23
2026-01-16 00:16:06,568 - INFO -     Max value: 2688
2026-01-16 00:16:06,569 - INFO -     Outliers (>99th): 10051
2026-01-16 00:16:06,584 - INFO -     [OK] Capped at 99th percentile
2026-01-16 00:16:06,619 - INFO -   Column 'enrollments_age_5_17':
2026-01-16 00:16:06,620 - INFO -     95th percentile: 6
2026-01-16 00:16:06,620 - INFO -     99th percentile: 14
2026-01-16 00:16:06,621 - INFO -     Max value: 1812
2026-01-16 00:16:06,621 - INFO -     Outliers (>99th): 9594
2026-01-16 00:16:06,638 - INFO -     [OK] Capped at 99th percentile
2026-01-16 00:16:06,667 - INFO -   Column 'enrollments_age_18_plus':
2026-01-16 00:16:06,668 - INFO -     95th percentile: 0
2026-01-16 00:16:06,668 - INFO -     99th percentile: 2
2026-01-16 00:16:06,669 - INFO -     Max value: 855
2026-01-16 00:16:06,669 - INFO -     Outliers (>99th): 8628
2026-01-16 00:16:06,686 - INFO -     [OK] Capped at 99th percentile
2026-01-16 00:16:06,686 - INFO - Step 6: Aggregating data to monthly level
2026-01-16 00:16:08,383 - INFO -   [OK] Aggregated from 1005989 daily records to 106451 monthly records
2026-01-16 00:16:08,457 - INFO - Step 7: Calculating data quality metrics
2026-01-16 00:16:08,508 - INFO -   [OK] Quality metrics added
2026-01-16 00:16:08,509 - INFO - Final cleaned shape: (106451, 10)

2026-01-16 00:16:08,540 - INFO - 
================================================================================
2026-01-16 00:16:08,541 - INFO - STEP 9: Merging datasets into master table
2026-01-16 00:16:08,541 - INFO - ================================================================================
2026-01-16 00:16:08,828 - INFO - After biometric + demographic merge: (227539, 14)
2026-01-16 00:16:09,121 - INFO - After enrolment merge: (228525, 20)
2026-01-16 00:16:09,165 - INFO - [OK] Master dataset created with 10 activity columns

2026-01-16 00:16:19,739 - INFO - Creating visualization report...
2026-01-16 00:16:24,356 - INFO - 
================================================================================
2026-01-16 00:16:24,357 - INFO - GENERATING CLEANING SUMMARY REPORT
2026-01-16 00:16:24,357 - INFO - ================================================================================

2026-01-16 00:16:24,583 - INFO - CLEANING SUMMARY:
2026-01-16 00:16:24,584 - INFO -   Biometric:   222,617 records | States: 36/36 | Activity: 56,708,230
2026-01-16 00:16:24,584 - INFO -   Demographic: 130,988 records | States: 36/36 | Activity: 35,784,048
2026-01-16 00:16:24,584 - INFO -   Enrolment:   106,451 records | States: 36/36 | Activity: 4,120,628
2026-01-16 00:16:24,585 - INFO -   Master:      228,525 records | States: 36/36

2026-01-16 00:16:24,589 - INFO - 
================================================================================
2026-01-16 00:16:24,590 - INFO - PIPELINE COMPLETED SUCCESSFULLY [OK]
2026-01-16 00:16:24,590 - INFO - ================================================================================
2026-01-16 00:21:31,349 - INFO - 
================================================================================
2026-01-16 00:21:31,350 - INFO - AADHAAR DATA CLEANING PIPELINE - STARTED
2026-01-16 00:21:31,350 - INFO - ================================================================================

2026-01-16 00:21:31,350 - INFO - 
================================================================================
2026-01-16 00:21:31,350 - INFO - PROCESSING: AADHAAR BIOMETRIC UPDATE DATASET
2026-01-16 00:21:31,350 - INFO - ================================================================================
2026-01-16 00:21:31,351 - INFO -   Loading api_data_aadhar_biometric_0_500000.csv...
2026-01-16 00:21:31,849 - INFO -   Loading api_data_aadhar_biometric_1000000_1500000.csv...
2026-01-16 00:21:32,354 - INFO -   Loading api_data_aadhar_biometric_1500000_1861108.csv...
2026-01-16 00:21:32,741 - INFO -   Loading api_data_aadhar_biometric_500000_1000000.csv...
2026-01-16 00:21:33,301 - INFO - Combined shape: (1861108, 6)
2026-01-16 00:21:33,301 - INFO - Step 1: Fixing schema and datatypes for AADHAAR BIOMETRIC UPDATE DATASET
2026-01-16 00:21:33,701 - INFO -   [OK] Schema fixed. Shape: (1861108, 6)
2026-01-16 00:21:33,701 - INFO - Step 2: Standardizing state names
2026-01-16 00:21:39,952 - INFO -   Valid states: 1861022
2026-01-16 00:21:39,952 - INFO -   Invalid states: 86
2026-01-16 00:21:39,956 - WARNING -   [WARNING] Top invalid state entries:
2026-01-16 00:21:39,957 - WARNING -      'west bangal': 51 records
2026-01-16 00:21:39,957 - WARNING -      'westbengal': 29 records
2026-01-16 00:21:39,957 - WARNING -      'chhatisgarh': 5 records
2026-01-16 00:21:39,957 - WARNING -      'tamilnadu': 1 records
2026-01-16 00:21:40,753 - INFO -   [OK] States standardized. Valid unique states: 36/36
2026-01-16 00:21:40,790 - INFO - Step 3: Standardizing district names
2026-01-16 00:21:45,779 - INFO -   [OK] Districts standardized. Unique districts: 949
2026-01-16 00:21:45,780 - INFO - Step 4: Validating PIN codes
2026-01-16 00:21:49,555 - INFO -   [OK] PIN codes validated. Records retained: 1861022/1861022
2026-01-16 00:21:49,598 - INFO - Step 5: Handling numeric outliers
2026-01-16 00:21:49,685 - INFO -   Column 'updates_age_5_17':
2026-01-16 00:21:49,685 - INFO -     95th percentile: 61
2026-01-16 00:21:49,686 - INFO -     99th percentile: 298
2026-01-16 00:21:49,686 - INFO -     Max value: 8002
2026-01-16 00:21:49,686 - INFO -     Outliers (>99th): 18546
2026-01-16 00:21:49,715 - INFO -     [OK] Capped at 99th percentile
2026-01-16 00:21:49,787 - INFO -   Column 'updates_age_18_plus':
2026-01-16 00:21:49,788 - INFO -     95th percentile: 62
2026-01-16 00:21:49,788 - INFO -     99th percentile: 324
2026-01-16 00:21:49,788 - INFO -     Max value: 7625
2026-01-16 00:21:49,788 - INFO -     Outliers (>99th): 18574
2026-01-16 00:21:49,815 - INFO -     [OK] Capped at 99th percentile
2026-01-16 00:21:49,815 - INFO - Step 6: Aggregating data to monthly level
2026-01-16 00:21:51,338 - INFO -   [OK] Aggregated from 1861022 daily records to 222617 monthly records
2026-01-16 00:21:51,409 - INFO - Step 7: Calculating data quality metrics
2026-01-16 00:21:51,520 - INFO -   [OK] Quality metrics added
2026-01-16 00:21:51,520 - INFO - Final cleaned shape: (222617, 9)

2026-01-16 00:21:51,594 - INFO - 
================================================================================
2026-01-16 00:21:51,594 - INFO - PROCESSING: AADHAAR DEMOGRAPHIC UPDATE DATASET
2026-01-16 00:21:51,594 - INFO - ================================================================================
2026-01-16 00:21:51,595 - INFO -   Loading api_data_aadhar_demographic_0_500000.csv...
2026-01-16 00:21:52,201 - INFO -   Loading api_data_aadhar_demographic_1000000_1500000.csv...
2026-01-16 00:21:52,850 - INFO -   Loading api_data_aadhar_demographic_1500000_2000000.csv...
2026-01-16 00:21:53,429 - INFO -   Loading api_data_aadhar_demographic_2000000_2071700.csv...
2026-01-16 00:21:53,525 - INFO -   Loading api_data_aadhar_demographic_500000_1000000.csv...
2026-01-16 00:21:54,159 - INFO - Combined shape: (2071700, 6)
2026-01-16 00:21:54,159 - INFO - Step 1: Fixing schema and datatypes for AADHAAR DEMOGRAPHIC UPDATE DATASET
2026-01-16 00:21:54,719 - INFO -   [OK] Schema fixed. Shape: (2071700, 6)
2026-01-16 00:21:54,719 - INFO - Step 2: Standardizing state names
2026-01-16 00:22:02,358 - INFO -   Valid states: 2071421
2026-01-16 00:22:02,358 - INFO -   Invalid states: 279
2026-01-16 00:22:02,363 - WARNING -   [WARNING] Top invalid state entries:
2026-01-16 00:22:02,363 - WARNING -      'westbengal': 132 records
2026-01-16 00:22:02,363 - WARNING -      'west bangal': 127 records
2026-01-16 00:22:02,364 - WARNING -      'chhatisgarh': 4 records
2026-01-16 00:22:02,364 - WARNING -      'west bengli': 3 records
2026-01-16 00:22:02,364 - WARNING -      'darbhanga': 2 records
2026-01-16 00:22:02,364 - WARNING -      'balanagar': 2 records
2026-01-16 00:22:02,364 - WARNING -      'jaipur': 2 records
2026-01-16 00:22:02,364 - WARNING -      'madanapalle': 2 records
2026-01-16 00:22:02,364 - WARNING -      '100000': 2 records
2026-01-16 00:22:02,364 - WARNING -      'puttenahalli': 1 records
2026-01-16 00:22:03,165 - INFO -   [OK] States standardized. Valid unique states: 36/36
2026-01-16 00:22:03,205 - INFO - Step 3: Standardizing district names
2026-01-16 00:22:08,609 - INFO -   [OK] Districts standardized. Unique districts: 952
2026-01-16 00:22:08,609 - INFO - Step 4: Validating PIN codes
2026-01-16 00:22:11,861 - INFO -   [OK] PIN codes validated. Records retained: 2071421/2071421
2026-01-16 00:22:11,903 - INFO - Step 5: Handling numeric outliers
2026-01-16 00:22:11,949 - INFO -   Column 'updates_age_5_17':
2026-01-16 00:22:11,949 - INFO -     95th percentile: 7
2026-01-16 00:22:11,949 - INFO -     99th percentile: 22
2026-01-16 00:22:11,949 - INFO -     Max value: 2690
2026-01-16 00:22:11,949 - INFO -     Outliers (>99th): 20037
2026-01-16 00:22:11,974 - INFO -     [OK] Capped at 99th percentile
2026-01-16 00:22:12,024 - INFO -   Column 'updates_age_18_plus':
2026-01-16 00:22:12,024 - INFO -     95th percentile: 60
2026-01-16 00:22:12,024 - INFO -     99th percentile: 226
2026-01-16 00:22:12,024 - INFO -     Max value: 16166
2026-01-16 00:22:12,024 - INFO -     Outliers (>99th): 20663
2026-01-16 00:22:12,048 - INFO -     [OK] Capped at 99th percentile
2026-01-16 00:22:12,049 - INFO - Step 6: Aggregating data to monthly level
2026-01-16 00:22:13,145 - INFO -   [OK] Aggregated from 2071421 daily records to 130988 monthly records
2026-01-16 00:22:13,219 - INFO - Step 7: Calculating data quality metrics
2026-01-16 00:22:13,278 - INFO -   [OK] Quality metrics added
2026-01-16 00:22:13,278 - INFO - Final cleaned shape: (130988, 9)

2026-01-16 00:22:13,338 - INFO - 
================================================================================
2026-01-16 00:22:13,338 - INFO - PROCESSING: AADHAAR ENROLMENT DATASET
2026-01-16 00:22:13,338 - INFO - ================================================================================
2026-01-16 00:22:13,341 - INFO -   Loading api_data_aadhar_enrolment_0_500000.csv...
2026-01-16 00:22:13,838 - INFO -   Loading api_data_aadhar_enrolment_1000000_1006029.csv...
2026-01-16 00:22:13,851 - INFO -   Loading api_data_aadhar_enrolment_500000_1000000.csv...
2026-01-16 00:22:14,366 - INFO - Combined shape: (1006029, 7)
2026-01-16 00:22:14,367 - INFO - Step 1: Fixing schema and datatypes for AADHAAR ENROLMENT DATASET
2026-01-16 00:22:14,559 - INFO -   [OK] Schema fixed. Shape: (1006029, 7)
2026-01-16 00:22:14,559 - INFO - Step 2: Standardizing state names
2026-01-16 00:22:27,992 - INFO - 
================================================================================
2026-01-16 00:22:27,992 - INFO - AADHAAR DATA CLEANING PIPELINE - STARTED
2026-01-16 00:22:27,993 - INFO - ================================================================================

2026-01-16 00:22:27,993 - INFO - 
================================================================================
2026-01-16 00:22:27,993 - INFO - PROCESSING: AADHAAR BIOMETRIC UPDATE DATASET
2026-01-16 00:22:27,994 - INFO - ================================================================================
2026-01-16 00:22:27,995 - INFO -   Loading api_data_aadhar_biometric_0_500000.csv...
2026-01-16 00:22:28,550 - INFO -   Loading api_data_aadhar_biometric_1000000_1500000.csv...
2026-01-16 00:22:29,055 - INFO -   Loading api_data_aadhar_biometric_1500000_1861108.csv...
2026-01-16 00:22:29,450 - INFO -   Loading api_data_aadhar_biometric_500000_1000000.csv...
2026-01-16 00:22:30,001 - INFO - Combined shape: (1861108, 6)
2026-01-16 00:22:30,002 - INFO - Step 1: Fixing schema and datatypes for AADHAAR BIOMETRIC UPDATE DATASET
2026-01-16 00:22:30,385 - INFO -   [OK] Schema fixed. Shape: (1861108, 6)
2026-01-16 00:22:30,386 - INFO - Step 2: Standardizing state names
2026-01-16 00:22:36,606 - INFO -   Valid states: 1861022
2026-01-16 00:22:36,607 - INFO -   Invalid states: 86
2026-01-16 00:22:36,611 - WARNING -   [WARNING] Top invalid state entries:
2026-01-16 00:22:36,611 - WARNING -      'west bangal': 51 records
2026-01-16 00:22:36,612 - WARNING -      'westbengal': 29 records
2026-01-16 00:22:36,612 - WARNING -      'chhatisgarh': 5 records
2026-01-16 00:22:36,612 - WARNING -      'tamilnadu': 1 records
2026-01-16 00:22:37,242 - INFO -   [OK] States standardized. Valid unique states: 36/36
2026-01-16 00:22:37,270 - INFO - Step 3: Standardizing district names
2026-01-16 00:22:41,811 - INFO -   [OK] Districts standardized. Unique districts: 949
2026-01-16 00:22:41,812 - INFO - Step 4: Validating PIN codes
2026-01-16 00:22:44,728 - INFO -   [OK] PIN codes validated. Records retained: 1861022/1861022
2026-01-16 00:22:44,757 - INFO - Step 5: Handling numeric outliers
2026-01-16 00:22:44,833 - INFO -   Column 'updates_age_5_17':
2026-01-16 00:22:44,834 - INFO -     95th percentile: 61
2026-01-16 00:22:44,834 - INFO -     99th percentile: 298
2026-01-16 00:22:44,834 - INFO -     Max value: 8002
2026-01-16 00:22:44,835 - INFO -     Outliers (>99th): 18546
2026-01-16 00:22:44,859 - INFO -     [OK] Capped at 99th percentile
2026-01-16 00:22:44,927 - INFO -   Column 'updates_age_18_plus':
2026-01-16 00:22:44,927 - INFO -     95th percentile: 62
2026-01-16 00:22:44,928 - INFO -     99th percentile: 324
2026-01-16 00:22:44,928 - INFO -     Max value: 7625
2026-01-16 00:22:44,928 - INFO -     Outliers (>99th): 18574
2026-01-16 00:22:44,954 - INFO -     [OK] Capped at 99th percentile
2026-01-16 00:22:44,954 - INFO - Step 6: Aggregating data to monthly level
2026-01-16 00:22:46,006 - INFO -   [OK] Aggregated from 1861022 daily records to 222617 monthly records
2026-01-16 00:22:46,069 - INFO - Step 7: Calculating data quality metrics
2026-01-16 00:22:46,170 - INFO -   [OK] Quality metrics added
2026-01-16 00:22:46,171 - INFO - Final cleaned shape: (222617, 9)

2026-01-16 00:22:46,225 - INFO - 
================================================================================
2026-01-16 00:22:46,225 - INFO - PROCESSING: AADHAAR DEMOGRAPHIC UPDATE DATASET
2026-01-16 00:22:46,225 - INFO - ================================================================================
2026-01-16 00:22:46,226 - INFO -   Loading api_data_aadhar_demographic_0_500000.csv...
2026-01-16 00:22:46,733 - INFO -   Loading api_data_aadhar_demographic_1000000_1500000.csv...
2026-01-16 00:22:47,237 - INFO -   Loading api_data_aadhar_demographic_1500000_2000000.csv...
2026-01-16 00:22:47,752 - INFO -   Loading api_data_aadhar_demographic_2000000_2071700.csv...
2026-01-16 00:22:47,834 - INFO -   Loading api_data_aadhar_demographic_500000_1000000.csv...
2026-01-16 00:22:48,404 - INFO - Combined shape: (2071700, 6)
2026-01-16 00:22:48,404 - INFO - Step 1: Fixing schema and datatypes for AADHAAR DEMOGRAPHIC UPDATE DATASET
2026-01-16 00:22:48,880 - INFO -   [OK] Schema fixed. Shape: (2071700, 6)
2026-01-16 00:22:48,880 - INFO - Step 2: Standardizing state names
2026-01-16 00:22:55,924 - INFO -   Valid states: 2071421
2026-01-16 00:22:55,924 - INFO -   Invalid states: 279
2026-01-16 00:22:55,929 - WARNING -   [WARNING] Top invalid state entries:
2026-01-16 00:22:55,929 - WARNING -      'westbengal': 132 records
2026-01-16 00:22:55,930 - WARNING -      'west bangal': 127 records
2026-01-16 00:22:55,930 - WARNING -      'chhatisgarh': 4 records
2026-01-16 00:22:55,931 - WARNING -      'west bengli': 3 records
2026-01-16 00:22:55,931 - WARNING -      'darbhanga': 2 records
2026-01-16 00:22:55,931 - WARNING -      'balanagar': 2 records
2026-01-16 00:22:55,932 - WARNING -      'jaipur': 2 records
2026-01-16 00:22:55,932 - WARNING -      'madanapalle': 2 records
2026-01-16 00:22:55,933 - WARNING -      '100000': 2 records
2026-01-16 00:22:55,933 - WARNING -      'puttenahalli': 1 records
2026-01-16 00:22:56,661 - INFO -   [OK] States standardized. Valid unique states: 36/36
2026-01-16 00:22:56,695 - INFO - Step 3: Standardizing district names
2026-01-16 00:23:01,957 - INFO -   [OK] Districts standardized. Unique districts: 952
2026-01-16 00:23:01,958 - INFO - Step 4: Validating PIN codes
2026-01-16 00:23:05,363 - INFO -   [OK] PIN codes validated. Records retained: 2071421/2071421
2026-01-16 00:23:05,405 - INFO - Step 5: Handling numeric outliers
2026-01-16 00:23:05,459 - INFO -   Column 'updates_age_5_17':
2026-01-16 00:23:05,460 - INFO -     95th percentile: 7
2026-01-16 00:23:05,461 - INFO -     99th percentile: 22
2026-01-16 00:23:05,461 - INFO -     Max value: 2690
2026-01-16 00:23:05,462 - INFO -     Outliers (>99th): 20037
2026-01-16 00:23:05,494 - INFO -     [OK] Capped at 99th percentile
2026-01-16 00:23:05,553 - INFO -   Column 'updates_age_18_plus':
2026-01-16 00:23:05,553 - INFO -     95th percentile: 60
2026-01-16 00:23:05,554 - INFO -     99th percentile: 226
2026-01-16 00:23:05,554 - INFO -     Max value: 16166
2026-01-16 00:23:05,554 - INFO -     Outliers (>99th): 20663
2026-01-16 00:23:05,585 - INFO -     [OK] Capped at 99th percentile
2026-01-16 00:23:05,585 - INFO - Step 6: Aggregating data to monthly level
2026-01-16 00:23:06,891 - INFO -   [OK] Aggregated from 2071421 daily records to 130988 monthly records
2026-01-16 00:23:06,974 - INFO - Step 7: Calculating data quality metrics
2026-01-16 00:23:07,040 - INFO -   [OK] Quality metrics added
2026-01-16 00:23:07,041 - INFO - Final cleaned shape: (130988, 9)

2026-01-16 00:23:07,102 - INFO - 
================================================================================
2026-01-16 00:23:07,103 - INFO - PROCESSING: AADHAAR ENROLMENT DATASET
2026-01-16 00:23:07,104 - INFO - ================================================================================
2026-01-16 00:23:07,104 - INFO -   Loading api_data_aadhar_enrolment_0_500000.csv...
2026-01-16 00:23:07,642 - INFO -   Loading api_data_aadhar_enrolment_1000000_1006029.csv...
2026-01-16 00:23:07,656 - INFO -   Loading api_data_aadhar_enrolment_500000_1000000.csv...
2026-01-16 00:23:08,239 - INFO - Combined shape: (1006029, 7)
2026-01-16 00:23:08,240 - INFO - Step 1: Fixing schema and datatypes for AADHAAR ENROLMENT DATASET
2026-01-16 00:23:08,476 - INFO -   [OK] Schema fixed. Shape: (1006029, 7)
2026-01-16 00:23:08,477 - INFO - Step 2: Standardizing state names
2026-01-16 00:23:11,875 - INFO -   Valid states: 1005989
2026-01-16 00:23:11,875 - INFO -   Invalid states: 40
2026-01-16 00:23:11,878 - WARNING -   [WARNING] Top invalid state entries:
2026-01-16 00:23:11,878 - WARNING -      '100000': 22 records
2026-01-16 00:23:11,879 - WARNING -      'west bangal': 9 records
2026-01-16 00:23:11,879 - WARNING -      'westbengal': 7 records
2026-01-16 00:23:11,879 - WARNING -      'the dadra and nagar haveli and daman and diu': 2 records
2026-01-16 00:23:12,302 - INFO -   [OK] States standardized. Valid unique states: 36/36
2026-01-16 00:23:12,321 - INFO - Step 3: Standardizing district names
2026-01-16 00:23:14,908 - INFO -   [OK] Districts standardized. Unique districts: 963
2026-01-16 00:23:14,909 - INFO - Step 4: Validating PIN codes
2026-01-16 00:23:16,550 - INFO -   [OK] PIN codes validated. Records retained: 1005989/1005989
2026-01-16 00:23:16,573 - INFO - Step 5: Handling numeric outliers
2026-01-16 00:23:16,615 - INFO -   Column 'enrollments_age_0_5':
2026-01-16 00:23:16,615 - INFO -     95th percentile: 10
2026-01-16 00:23:16,616 - INFO -     99th percentile: 23
2026-01-16 00:23:16,617 - INFO -     Max value: 2688
2026-01-16 00:23:16,617 - INFO -     Outliers (>99th): 10051
2026-01-16 00:23:16,632 - INFO -     [OK] Capped at 99th percentile
2026-01-16 00:23:16,666 - INFO -   Column 'enrollments_age_5_17':
2026-01-16 00:23:16,666 - INFO -     95th percentile: 6
2026-01-16 00:23:16,667 - INFO -     99th percentile: 14
2026-01-16 00:23:16,667 - INFO -     Max value: 1812
2026-01-16 00:23:16,667 - INFO -     Outliers (>99th): 9594
2026-01-16 00:23:16,684 - INFO -     [OK] Capped at 99th percentile
2026-01-16 00:23:16,712 - INFO -   Column 'enrollments_age_18_plus':
2026-01-16 00:23:16,713 - INFO -     95th percentile: 0
2026-01-16 00:23:16,713 - INFO -     99th percentile: 2
2026-01-16 00:23:16,714 - INFO -     Max value: 855
2026-01-16 00:23:16,714 - INFO -     Outliers (>99th): 8628
2026-01-16 00:23:16,729 - INFO -     [OK] Capped at 99th percentile
2026-01-16 00:23:16,730 - INFO - Step 6: Aggregating data to monthly level
2026-01-16 00:23:18,255 - INFO -   [OK] Aggregated from 1005989 daily records to 106451 monthly records
2026-01-16 00:23:18,329 - INFO - Step 7: Calculating data quality metrics
2026-01-16 00:23:18,387 - INFO -   [OK] Quality metrics added
2026-01-16 00:23:18,387 - INFO - Final cleaned shape: (106451, 10)

2026-01-16 00:23:18,418 - INFO - 
================================================================================
2026-01-16 00:23:18,418 - INFO - STEP 9: Merging datasets into master table
2026-01-16 00:23:18,419 - INFO - ================================================================================
2026-01-16 00:23:18,708 - INFO - After biometric + demographic merge: (227539, 14)
2026-01-16 00:23:18,980 - INFO - After enrolment merge: (228525, 20)
2026-01-16 00:23:19,021 - INFO - [OK] Master dataset created with 10 activity columns

2026-01-16 00:23:27,471 - INFO - [OK] Cleaned datasets saved to cleaned_data/
2026-01-16 00:23:27,472 - INFO - Creating visualization report...
2026-01-16 00:23:30,838 - INFO - [OK] Visualization saved to cleaned_data\cleaning_comparison.png
2026-01-16 00:23:30,917 - INFO - 
================================================================================
2026-01-16 00:23:30,918 - INFO - GENERATING CLEANING SUMMARY REPORT
2026-01-16 00:23:30,918 - INFO - ================================================================================

2026-01-16 00:23:31,121 - INFO - CLEANING SUMMARY:
2026-01-16 00:23:31,121 - INFO -   Biometric:   222,617 records | States: 36/36 | Activity: 56,708,230
2026-01-16 00:23:31,122 - INFO -   Demographic: 130,988 records | States: 36/36 | Activity: 35,784,048
2026-01-16 00:23:31,122 - INFO -   Enrolment:   106,451 records | States: 36/36 | Activity: 4,120,628
2026-01-16 00:23:31,123 - INFO -   Master:      228,525 records | States: 36/36

2026-01-16 00:23:31,123 - INFO - [OK] Report saved to cleaned_data\cleaning_report.json
2026-01-16 00:23:31,123 - INFO - 
================================================================================
2026-01-16 00:23:31,124 - INFO - PIPELINE COMPLETED SUCCESSFULLY [OK]
2026-01-16 00:23:31,124 - INFO - ================================================================================
